{
  "id": "content.legal-part",
  "kind": "section",
  "category": "CONTENT",
  "semantic": {
    "id": "content.legal-part",
    "category": "CONTENT"
  },
  "source": {
    "id": "src:Legal.H@32",
    "tag": "H",
    "file": "src/pages/Legal.jsx",
    "lines": "32-37"
  },
  "purpose": "One heading-bounded part of a legal document: a heading of the document's dominant level (h2 in terms of service, h4 in data privacy) and the blocks until the next heading of that level. Repeatable; imprint has none.",
  "tags": [
    "legal",
    "prose",
    "part"
  ],
  "status": "mounted",
  "implementedBy": [
    "src/pages/Legal.jsx",
    "src/pages/legal/content.js",
    "src/pages/legal/legal.css"
  ],
  "evidence": {
    "level": "measured",
    "unmeasured": []
  },
  "allowedTemplates": [
    "template.legal"
  ],
  "variants": [
    "default"
  ],
  "constraints": {},
  "content": {
    "fields": {
      "heading": {
        "type": "text",
        "required": true,
        "maxWords": 18,
        "maxWordsBasis": "longest real legal heading: data-privacy h4 'Notification obligation regarding rectification ...' = 18 words (src/pages/legal/content.js)"
      },
      "headingLevel": {
        "type": "enum",
        "required": true,
        "values": [
          "h2",
          "h3",
          "h4"
        ]
      },
      "blocks": {
        "type": "list",
        "required": false,
        "minItems": 1,
        "maxItems": 60,
        "item": {
          "type": "object",
          "required": true,
          "fields": {
            "type": {
              "type": "enum",
              "required": true,
              "values": [
                "p",
                "h2",
                "h3",
                "h4",
                "h6",
                "ul",
                "ol",
                "spacer",
                "empty"
              ]
            },
            "text": {
              "type": "text",
              "required": false,
              "maxWords": 400,
              "maxWordsBasis": "spec C3: largest single paragraph is data-privacy 'Applications' 1 p ~399w"
            },
            "items": {
              "type": "list",
              "required": false,
              "minItems": 1,
              "maxItems": 25,
              "item": {
                "type": "text",
                "required": true,
                "maxWords": 140,
                "maxWordsBasis": "spec C3: 'Meta Pixel' ul x3 items ~403w, i.e. ~134w per item"
              },
              "countBasis": "spec C3: terms-of-service prohibited-activities list has 23 items"
            }
          }
        },
        "countBasis": "estimate: one heading's paragraphs, labels, lists and nested sub-headings (terms of service part 2 nests four h3 subsections); not an exact count"
      }
    },
    "additionalProperties": false
  },
  "motion": {
    "allowed": [
      {
        "pattern": "hover-color",
        "trigger": "hover",
        "reducedMotionFallback": "instant-swap",
        "note": "rich-text links #594AFF -> #212121 + underline, instant",
        "measuredFrom": [
          "specs/company-careers-legal.md:168"
        ]
      }
    ],
    "reducedMotionHandledInSource": "no",
    "reducedMotionSource": "no motion in this section"
  },
  "responsive": {
    "desktop": "section padding 152/80/120; column 768 centered",
    "tablet": "column 650",
    "phone": "padding 24; column 342"
  },
  "notes": [
    "Part boundaries are the document's own headings (Legal.jsx renders content.js blocks in order).",
    "R6 decomposition: the measured page showed one section holding most of the page (legal 95%, blog post 81%, case study 81% of page height at 1440px; extraction/measured-values.json sectionHeights), so the former whole-page contract was split at real content boundaries."
  ],
  "measuredFrom": [
    "src/pages/legal/content.js:54",
    "src/pages/legal/content.js:69-71",
    "specs/company-careers-legal.md:161"
  ],
  "retrievalEligible": true,
  "rules": [],
  "assetRoles": [],
  "version": "1.1.0",
  "generatedAssetRoles": []
}
